{
  "kicker": "문제 인식",
  "title": "단일 AI 질의는 왜 부족한가",
  "chat": {
    "windowLabel": "일반 챗봇 — 질의 1회",
    "question": "AP 패키지 중앙 솔더볼, 왜 깨졌을까요?",
    "barWidths": [
      500,
      560,
      460,
      320
    ],
    "verdict": "하나의 관점으로 뭉뚱그려진, 평균적인 답"
  },
  "claim": {
    "lead": "불량 원인 규명, 설계안 선정 —",
    "strong": {
      "pre": "여러 분야의 전문성이 ",
      "accent": "동시에",
      "post": " 필요한"
    },
    "tail": " 문제입니다."
  },
  "failures": [
    "관점의 충돌이 없다",
    "상호 반박이 없다",
    "스스로 검증하지 못한다"
  ],
  "conclusion": "한 번의 답변으로는, 의사결정이 되지 않습니다.",
  "frame": {
    "brand": "HWAX 협업진단 플랫폼",
    "total": "07",
    "idx": "02"
  }
}
